[
  {
    "name": "Outbound-AS",
    "botnet_list": [
      {
        "name": "default-paloalto-dns",
        "action": "sinkhole",
        "packet_capture": "single-packet"
      }
    ],
    "dns_category": [
      {
        "name": "pan-dns-sec-benign",
        "log_level": "default",
        "action": "default",
        "packet_capture": "disable"
      },
      {
        "name": "pan-dns-sec-cc",
        "log_level": "default",
        "action": "sinkhole",
        "packet_capture": "single-packet"
      },
      {
        "name": "pan-dns-sec-ddns",
        "log_level": "default",
        "action": "default",
        "packet_capture": "single-packet"
      },
      {
        "name": "pan-dns-sec-grayware",
        "log_level":"default",
        "action":"sinkhole",
        "packet_capture":"single-packet"
      },
      {
        "name":"pan-dns-sec-malware",
        "log_level":"default",
        "action":"sinkhole",
        "packet_capture":"single-packet"
      },
      {
        "name":"pan-dns-sec-parked",
        "log_level":"default",
        "action":"default",
        "packet_capture":"disable"
      },
      {
        "name":"pan-dns-sec-phishing",
        "log_level":"default",
        "action":"sinkhole",
        "packet_capture":"single-packet"
      },
      {
        "name":"pan-dns-sec-proxy",
        "log_level":"default",
        "action":"sinkhole",
        "packet_capture":"single-packet"
      },
      {
        "name":"pan-dns-sec-recent",
        "log_level":"default",
        "action":"default",
        "packet_capture":"single-packet"
      }
    ],
    "sinkhole_ipv4_address": "72.5.65.111",
    "sinkhole_ipv6_address":"2600:5200::1",
    "rule":
    [
      {
        "name": "Block-Critical-High-Medium",
        "action": "reset-both",
        "severities": ["critical","high","medium"],
        "threat_name": "any",
        "category": "any",
        "packet_capture": "single-packet"
      },
      {
        "name": "Default-Low-Info",
        "action": "default",
        "severities":["low","informational"],
        "threat_name": "any",
        "category":"any",
        "packet_capture":"disable"
      }
    ]
  },
  {
    "name": "Inbound-AS",
    "botnet_list": [
      {
        "name": "default-paloalto-dns",
        "action": "sinkhole",
        "packet_capture": "single-packet"
      }
    ],
    "dns_category": [
      {
        "name": "pan-dns-sec-benign",
        "log_level": "default",
        "action": "default",
        "packet_capture": "disable"
      },
      {
        "name": "pan-dns-sec-cc",
        "log_level": "default",
        "action": "sinkhole",
        "packet_capture": "single-packet"
      },
      {
        "name": "pan-dns-sec-ddns",
        "log_level": "default",
        "action": "default",
        "packet_capture": "single-packet"
      },
      {
        "name": "pan-dns-sec-grayware",
        "log_level":"default",
        "action":"sinkhole",
        "packet_capture":"single-packet"
      },
      {
        "name":"pan-dns-sec-malware",
        "log_level":"default",
        "action":"sinkhole",
        "packet_capture":"single-packet"
      },
      {
        "name":"pan-dns-sec-parked",
        "log_level":"default",
        "action":"default",
        "packet_capture":"disable"
      },
      {
        "name":"pan-dns-sec-phishing",
        "log_level":"default",
        "action":"sinkhole",
        "packet_capture":"single-packet"
      },
      {
        "name":"pan-dns-sec-proxy",
        "log_level":"default",
        "action":"sinkhole",
        "packet_capture":"single-packet"
      },
      {
        "name":"pan-dns-sec-recent",
        "log_level":"default",
        "action":"default",
        "packet_capture":"single-packet"
      }
    ],
    "sinkhole_ipv4_address": "72.5.65.111",
    "sinkhole_ipv6_address":"2600:5200::1",
    "rule":
    [
      {
        "name": "Block-Critical-High-Medium",
        "action": "reset-both",
        "severities": ["critical","high","medium"],
        "threat_name": "any",
        "category": "any",
        "packet_capture": "single-packet"
      },
      {
        "name": "Default-Low-Info",
        "action": "default",
        "severities":["low","informational"],
        "threat_name": "any",
        "category":"any",
        "packet_capture":"disable"
      }
    ]
  },
  {
    "name":"Internal-AS",
    "botnet_list": [
      {
        "name": "default-paloalto-dns",
        "action": "sinkhole",
        "packet_capture": "single-packet"
      }
    ],
    "dns_category": [
      {
        "name": "pan-dns-sec-benign",
        "log_level": "default",
        "action": "default",
        "packet_capture": "disable"
      },
      {
        "name": "pan-dns-sec-cc",
        "log_level": "default",
        "action": "sinkhole",
        "packet_capture": "single-packet"
      },
      {
        "name": "pan-dns-sec-ddns",
        "log_level": "default",
        "action": "default",
        "packet_capture": "single-packet"
      },
      {
        "name": "pan-dns-sec-grayware",
        "log_level":"default",
        "action":"sinkhole",
        "packet_capture":"single-packet"
      },
      {
        "name":"pan-dns-sec-malware",
        "log_level":"default",
        "action":"sinkhole",
        "packet_capture":"single-packet"
      },
      {
        "name":"pan-dns-sec-parked",
        "log_level":"default",
        "action":"default",
        "packet_capture":"disable"
      },
      {
        "name":"pan-dns-sec-phishing",
        "log_level":"default",
        "action":"sinkhole",
        "packet_capture":"single-packet"
      },
      {
        "name":"pan-dns-sec-proxy",
        "log_level":"default",
        "action":"sinkhole",
        "packet_capture":"single-packet"
      },
      {
        "name":"pan-dns-sec-recent",
        "log_level":"default",
        "action":"default",
        "packet_capture":"single-packet"
      }
    ],
    "sinkhole_ipv4_address": "72.5.65.111",
    "sinkhole_ipv6_address":"2600:5200::1",
    "rule":
    [
      {
        "name": "Block-Critical-High",
        "action": "reset-both",
        "severities": ["critical","high"],
        "threat_name": "any",
        "category": "any",
        "packet_capture": "single-packet"
      },
      {
        "name": "Default-Medium-Low-Info",
        "action": "default",
        "severities":["medium","low","informational"],
        "threat_name": "any",
        "category":"any",
        "packet_capture":"disable"
      }
    ]
  },
  {
    "name":"Alert-Only-AS",
    "botnet_list": [
      {
        "name": "default-paloalto-dns",
        "action": "alert",
        "packet_capture": "single-packet"
      }
    ],
    "dns_category": [
      {
        "name": "pan-dns-sec-benign",
        "log_level": "default",
        "action": "allow",
        "packet_capture": "disable"
      },
      {
        "name": "pan-dns-sec-cc",
        "log_level": "default",
        "action": "allow",
        "packet_capture": "single-packet"
      },
      {
        "name": "pan-dns-sec-ddns",
        "log_level": "default",
        "action": "allow",
        "packet_capture": "single-packet"
      },
      {
        "name": "pan-dns-sec-grayware",
        "log_level":"default",
        "action":"allow",
        "packet_capture":"single-packet"
      },
      {
        "name":"pan-dns-sec-malware",
        "log_level":"default",
        "action":"allow",
        "packet_capture":"single-packet"
      },
      {
        "name":"pan-dns-sec-parked",
        "log_level":"default",
        "action":"allow",
        "packet_capture":"single-packet"
      },
      {
        "name":"pan-dns-sec-phishing",
        "log_level":"default",
        "action":"allow",
        "packet_capture":"single-packet"
      },
      {
        "name":"pan-dns-sec-proxy",
        "log_level":"default",
        "action":"allow",
        "packet_capture":"single-packet"
      },
      {
        "name":"pan-dns-sec-recent",
        "log_level":"default",
        "action":"allow",
        "packet_capture":"single-packet"
      }
    ],
    "sinkhole_ipv4_address": "72.5.65.111",
    "sinkhole_ipv6_address":"2600:5200::1",
    "rule":
    [
      {
        "name": "Alert-All",
        "action": "alert",
        "severities": ["any"],
        "threat_name": "any",
        "category": "any",
        "packet_capture": "disable"
      }
    ]
  },
  {
    "name":"Exception-AS",
    "description":"Used for exception cases not part of the recommended practice",
    "botnet_list": [
      {
        "name": "default-paloalto-dns",
        "action": "sinkhole",
        "packet_capture": "single-packet"
      }
    ],
    "dns_category": [
      {
        "name": "pan-dns-sec-benign",
        "log_level": "default",
        "action": "default",
        "packet_capture": "disable"
      },
      {
        "name": "pan-dns-sec-cc",
        "log_level": "default",
        "action": "default",
        "packet_capture": "disable"
      },
      {
        "name": "pan-dns-sec-ddns",
        "log_level": "default",
        "action": "default",
        "packet_capture": "disable"
      },
      {
        "name": "pan-dns-sec-grayware",
        "log_level":"default",
        "action":"default",
        "packet_capture":"disable"
      },
      {
        "name":"pan-dns-sec-malware",
        "log_level":"default",
        "action":"default",
        "packet_capture":"disable"
      },
      {
        "name":"pan-dns-sec-parked",
        "log_level":"default",
        "action":"default",
        "packet_capture":"disable"
      },
      {
        "name":"pan-dns-sec-phishing",
        "log_level":"default",
        "action":"default",
        "packet_capture":"disable"
      },
      {
        "name":"pan-dns-sec-proxy",
        "log_level":"default",
        "action":"default",
        "packet_capture":"disable"
      },
      {
        "name":"pan-dns-sec-recent",